{
  "opera_riferimento": {
    "titolo": "Antartica - Quasi una fiaba",
    "autore": "Lucia Calamaro"
  },
  "tesi_editoriale": {
    "formulazione_accessibile": "Antartica racconta il desiderio umano di non finire, di strappare la vita al tempo, e mette di fronte due modi opposti di provarci: conservare — congelare, ibernare, fermare tutto nel ghiaccio — oppure trasmettere, consegnare ciò che si è scoperto e ciò che si è a chi viene dopo. Il cuore ironico del film è che a guidare la ricerca per sconfiggere la morte sia un uomo che sta morendo: la scoperta non salverà il suo scopritore, e questo suggerisce che l'unica vittoria possibile sulla morte non sia fermare la vita, ma passarla ad altri. Il sottotitolo 'quasi una fiaba' è il modo con cui il film tiene viva questa speranza senza poterla promettere.",
    "relazione_con_tesi_step4": "Riformulazione fedele e semplificata della tesi dello Step 4. Mantiene intatto il contenuto — le due figure del 'non morire del tutto' (conservazione tecnica vs trasmissione), l'ironia strutturale del ricercatore morente, il 'quasi' come forma della speranza non garantita — eliminando il lessico tecnico ('permanenza del medesimo', 'continuazione nell'altro', riferimenti agli assi) a favore di una resa narrativa immediata. L'enfasi resta sulla biforcazione tenuta aperta, non risolta."
  },
  "elementi_da_includere": {
    "step_1": [
      {
        "elemento": "La premessa: una piccola comunità di scienziati isolata otto mesi l'anno in una base antartica, che studia microrganismi conservati nel ghiaccio e l'ibernazione come conservazione della vita.",
        "funzione_editoriale": "È la cornice senza la quale nessuna immagine del film è leggibile: dà al lettore il luogo, la posta scientifica e la condizione di isolamento che concentra il dramma."
      },
      {
        "elemento": "Le due figure centrali: Cadorna, anziano capomissione malato, e Maria, scienziata appena arrivata, già sua allieva, con cui entra in conflitto.",
        "funzione_editoriale": "Sono i due poli umani su cui poggia la tesi (chi deve lasciare / chi deve raccogliere); vanno presentati con sobrietà, senza i dettagli incerti su nomi e parentela."
      },
      {
        "elemento": "Lo spunto reale: un microrganismo (rotifero) rimasto congelato per circa 22.000 anni e riportato in vita, citato dalla regista come riflessione sui tempi della vita umana.",
        "funzione_editoriale": "Aggancia il film a un fatto verificabile e affascinante che cattura il lettore e introduce con naturalezza il tema del tempo conservato."
      },
      {
        "elemento": "Il dato d'identità dell'opera: esordio cinematografico di Lucia Calamaro, drammaturga di teatro, uscito nel 2026; sottotitolo 'quasi una fiaba'.",
        "funzione_editoriale": "Colloca l'opera per un lettore che non la conosce e prepara la chiave di lettura tonale (la 'fiaba') senza appesantire."
      },
      {
        "elemento": "L'avvertenza che la lettura poggia su fonti secondarie, senza accesso alla visione integrale del film.",
        "funzione_editoriale": "Obbligo di trasparenza: va dichiarato con misura nel corpo o nella nota finale per non spacciare ricostruzioni per certezze."
      }
    ],
    "step_2": [
      {
        "elemento": "Il nucleo tematico centrale: non la scienza, ma il rapporto del vivente con la propria finitudine — arrestare o lasciar fluire.",
        "funzione_editoriale": "È la bussola che riorienta l'attenzione del lettore dal 'di cosa parla' (scienza, capitalismo) al 'quale esperienza umana mette in forma'."
      },
      {
        "elemento": "La tensione tra conservare e lasciar fluire: ciò che si salva dal tempo, forse, smette di vivere.",
        "funzione_editoriale": "Formula sintetica e memorabile che può fare da snodo argomentativo nel passaggio centrale del testo."
      },
      {
        "elemento": "La tensione tonale dichiarata dal 'quasi una fiaba': registro luminoso e caldo che avvolge una materia grave.",
        "funzione_editoriale": "Permette di tematizzare il tono del film come scelta poetica e non come semplice cornice, dando spessore alla chiusura."
      }
    ],
    "step_3": {
      "assi": ["asse_4", "asse_5", "asse_6"],
      "nodi": [
        "soglia-del-non-torna",
        "onnipotenza-implicita",
        "neutralizzazione-simbolica-del-limite",
        "bene-come-orientamento",
        "prestazionalizzazione-del-valore"
      ],
      "evidenze": [
        "Gli esperimenti di ibernazione falliti e le 'croci sulla neve'",
        "Il monologo finale di Cadorna come tenuta della perdita",
        "L'assemblea collettiva sul brevetto",
        "Il ghiaccio come archivio del tempo e promessa di arresto / il collasso onirico delle carote"
      ],
      "configurazione_dominante": true
    },
    "step_4": [
      {
        "elemento": "Le quattro scene forti già analizzate: croci sulla neve, monologo finale, assemblea sul brevetto, collasso delle carote di ghiaccio.",
        "funzione_editoriale": "Sono i pilastri narrativi pronti all'uso: ciascuna rende visibile e concreta una porzione della tesi senza bisogno di astrazione."
      },
      {
        "elemento": "La distinzione tra neutralizzare il limite (prevenirlo, comprarne il differimento) e attraversarlo (abitarlo senza spiegarlo).",
        "funzione_editoriale": "È l'idea più feconda e originale del saggio; va resa accessibile perché regge il senso dell'intera lettura."
      },
      {
        "elemento": "La contro-lettura: il film come apologo civile sul definanziamento e la mercificazione del vivente.",
        "funzione_editoriale": "Tiene onesta la lettura, mostra al lettore che l'opera è plurale e che la tesi è ipotesi controllata, non verdetto."
      },
      {
        "elemento": "I limiti della lettura: fonti secondarie, indecidibilità del finale, registro fiabesco che sfugge alla griglia.",
        "funzione_editoriale": "Garantisce la postura non conclusiva richiesta dal metodo e dal sottotitolo dell'opera; alimenta una chiusura aperta."
      },
      {
        "elemento": "La rilettura del legame Cadorna-Maria come attrito tra trattenere e trasmettere, non come rivalità psicologica o affettiva.",
        "funzione_editoriale": "Permette di trattare la relazione centrale in modo non gossipistico, ancorandola alla tesi delle due figure."
      }
    ]
  },
  "elementi_da_escludere": [
    {
      "elemento": "Le attribuzioni incerte personaggio-attore del cast secondario (Rita/Valentina Bellè, Mario Russo/Angelo Spagnoletti, ecc.) e i nomi non confermati.",
      "provenienza": "step_1",
      "motivo_esclusione": "appesantisce_senza_aggiungere"
    },
    {
      "elemento": "I dati produttivi (Wildside/Indigo, Sky, bunker del Monte Soratte, esterni in post-produzione, numero di sale, incasso).",
      "provenienza": "step_1",
      "motivo_esclusione": "non_supporta_la_tesi"
    },
    {
      "elemento": "La disputa sulla classificazione di genere (dramma vs commedia) e l'elenco delle fonti consultate.",
      "provenienza": "step_1",
      "motivo_esclusione": "troppo_tecnico"
    },
    {
      "elemento": "Le sei domande critiche aperte nella loro forma analitica e interrogativa.",
      "provenienza": "step_2",
      "motivo_esclusione": "troppo_tecnico"
    },
    {
      "elemento": "L'asse_1 (ontologico-fenomenologico) e l'asse_3 (normativo-educativo) come quadri espliciti, con i loro nodi (ipseità in divenire, fallibilità del giudizio, asimmetria educativa).",
      "provenienza": "step_3",
      "motivo_esclusione": "appesantisce_senza_aggiungere"
    },
    {
      "elemento": "L'asse_2 (affettivo-morale) e il nodo 'continuità oltre la presenza'.",
      "provenienza": "step_3",
      "motivo_esclusione": "rischio_di_forzatura"
    },
    {
      "elemento": "I 'nodi assenti' (riparazione non sostitutiva, co-regolazione, tempo del lutto non patologico) e l'apparato dei rischi di forzatura con le cautele metodologiche.",
      "provenienza": "step_3",
      "motivo_esclusione": "troppo_tecnico"
    },
    {
      "elemento": "La sezione 'assi integrati nel saggio' con le modalità di integrazione di ciascun asse.",
      "provenienza": "step_4",
      "motivo_esclusione": "troppo_tecnico"
    },
    {
      "elemento": "Le relazioni esplicite con l'ipotesi dello Step 2 e con la configurazione dello Step 3 (apparato di tracciabilità interna).",
      "provenienza": "step_4",
      "motivo_esclusione": "ridondante"
    }
  ],
  "scene_momenti_da_valorizzare": [
    {
      "titolo_sintetico": "Le croci sulla neve",
      "localizzazione": "Ricorrente nello sviluppo: le tappe degli esperimenti di ibernazione falliti.",
      "motivo_della_scelta": "È l'immagine che condensa in un colpo solo la posta in gioco: una comunità lavora per riportare la vita dal congelamento, e accanto al laboratorio cresce un piccolo cimitero. Rende visibile e fisico il limite che nessuna tecnica scioglie.",
      "come_raccontarla": "Aprire con l'immagine concreta: piccole croci piantate nella neve a segnare gli animali non risvegliati. Spiegare in una frase che la tecnica promette reversibilità e la neve restituisce tombe. Dichiarare con misura che il dettaglio proviene dalle recensioni, non dalla visione diretta."
    },
    {
      "titolo_sintetico": "Il monologo finale di Cadorna",
      "localizzazione": "Conclusione del film, in penombra e atmosfera onirica.",
      "motivo_della_scelta": "È il banco di prova della tesi: un uomo che ha guidato la ricerca contro la morte affronta la propria. È qui che il film può convertire il trattenere nel trasmettere — o limitarsi a sospendere. La sua ambiguità è il 'quasi' dell'opera.",